{
  "id": "d36267c5-6c9c-409e-b1c5-7a10f32ebe18",
  "kind": "process",
  "name": "LedgerOrder",
  "formatVersion": 1,
  "entity": "Request",
  "start": "createOrder",
  "steps": [
    {
      "name": "createOrder",
      "type": "operation",
      "operation": "callConnector",
      "connector": { "name": "Ledger", "operation": "createOrder" },
      "input": { "reference": "title", "amount": "amount", "note": "comment" },
      "output": { "orderNumber": "comment" },
      "next": "done"
    },
    { "name": "done", "type": "end" }
  ]
}
