{
  "id": "06bf5c2d-df18-4d48-9dc6-66396e30f300",
  "kind": "process",
  "name": "ChecklistReview",
  "formatVersion": 1,
  "entity": "Checklist",
  "start": "check",
  "steps": [
    { "name": "check", "type": "decision", "branches": [{ "when": "true", "next": "done" }], "otherwise": "done" },
    { "name": "done", "type": "end" }
  ]
}
