{
  "id": "976190b7-3ec9-4258-a2d8-d0aa93cfc0a1",
  "kind": "process",
  "name": "ApproveAtOnce",
  "formatVersion": 1,
  "entity": "signoffs/Request",
  "start": "approve",
  "steps": [
    {
      "name": "approve",
      "type": "operation",
      "operation": "updateRecord",
      "set": { "status": "'approved'" },
      "next": "finished"
    },
    { "name": "finished", "type": "end" }
  ]
}
